source,commentary
不知就先不知就後,所遇而安
若化爲物,不違化也
以待其所不知之化巳乎,死生宛轉與化爲一猶乃忘其所知於當今豈待所未知而豫憂者哉
且方將化惡知不化哉方將不化惡知巳化哉,巳化而生焉知未生之時哉未化而死焉知巳死之後哉故無所避就而與化倶生也○惡音烏下同焉於䖍反下皆同
吾特與汝其夢未始覺者邪,夫死生猶覺夢耳今夢自以爲覺則無以明覺之非夢也苟無以明覺之非夢則亦無以明生之非死矣死生覺夢未知所在當其所遇無不自得何爲在此而憂彼哉○覺古孝反注下皆同
且彼有駭形而無損心,以變化爲形之駭動耳故不以死生損累其心○駭形如字崔作咳云有嬰兒之形
有旦宅而無情死,似形骸之變爲旦宅之日新耳其情不以爲死○旦宅並如字王云旦暮改易宅是神居也李本作怛㤞上丹末反下陟嫁反云驚惋之貌崔本作靼宅靼怛也
孟孫氏特覺人哭亦哭是自其所以乃,夫常覺者無往而有逆也故人哭亦哭正自是其所宜也○乃崔本作惡
且也相與吾之耳矣,夫死生變化吾皆吾之旣皆自吾吾何失哉未始失吾吾何憂哉無逆故人哭亦哭無憂故哭而不哀
庸詎知吾所謂吾之乎,靡所不吾也故玄同外內彌貫古今與化日新豈知吾之所在也○詎其庶反下章同
且汝夢爲鳥而厲乎天夢爲魚而没於淵,言無往而不自得也
不識今之言者其覺者乎其夢者乎,夢之時自以爲覺則焉知今者之非夢邪亦焉知其非覺邪覺夢之化無往而不可則死生之變無時而足惜也
造適不及⬤獻⬤不及排,所造皆適則忘適矣故不及⬤也排者推移之謂也夫禮哭必哀獻⬤必樂哀樂存懷則不能與適推移矣今孟孫常適故哭而不哀與化倶往也○造七報反注同獻⬤向云獻善也王云章也意有適章於⬤故曰獻⬤排皮皆反樂音洛下同
安排而去化乃入於寥天一,安於推移而與化倶去故乃入於寂寥而與天爲一也自此以上至于子祀其致一也所執之䘮異故歌哭不同○寥本亦作廖力彫反李良救反天一崔本作造敵不及⬤獻⬤不及⬤安排而造化不及⬤⬤不及雄漂淰雄漂㑫不及簟筮簟筮乃入於漻天一上時掌反
意而子見許由許由曰堯何以資汝,資者給濟之謂○意而子李云賢士也資給也
意而子曰堯謂我汝必躬服仁義而明言是非許由曰而奚來爲軹夫堯旣已黥汝以仁義而劓汝以是非矣汝將何以遊夫遥蕩恣睢轉徙之⬤乎,言其將以形教自虧殘而不能復遊夫自得之塲無係之⬤也○軹之是反郭之忍反崔云軹辭也李云是也黥其京反劓魚器反李云毀道德以爲仁義不似黥乎破玄同以爲是非不似劓乎遥蕩王云縱散也恣七咨反又如字睢郭李云許維反徐許鼻反李王皆云恣睢自得貌復扶又反下同
意而子曰雖然吾願遊於其藩,不敢復求渉中道也且願遊其藩傍而已○藩甫煩反李音煩司馬向皆云崔也崔云域也
許由曰不然夫盲者無以與乎眉目顔色之好瞽者無以與乎青黃黼黻之觀意而子曰夫無莊之失其美據梁之失其力黃帝之亡其知皆在鑪捶之間耳,言天下之物未必皆自成也自然之理亦有須治鍜而爲噐者耳故此之三人亦皆聞道而後亡其所務也此皆⬤言以遣云爲之累○盲本又作⬤崔本作目云目或作刑刑黥劓也與音豫下同好如字又呼報反黼音甫黻音弗觀古亂反無莊據梁司馬云皆人名李云無莊無莊飾也據梁強梁也鑪音盧棰本又作徐之睡反又之蘂反一音時蘂反李云錘鴟頭頗口句鐡以吹火也崔云盧謂之瓮捶當作甀盧甀之間言小處也甀音丈僞反鍜丁亂反
庸詎知夫造物者之不息我黥而⬤我劓使我乗成以隨先生邪,夫率性直往者自然也往而傷性性傷而能改者亦自然也庸詎我知之自然當不息黥⬤劓而乗可成之道以隨夫子邪而欲弃而勿告恐非造物之至
許由曰噫未可知也我爲汝言其大略吾師乎吾師乎⬤萬物而不爲義澤及萬世而不爲仁,皆自爾耳亦無愛爲於其間也安所⬤其仁義○噫徐音醫李云歎聲也崔云辭也本亦作意音同又如字謂呼意而名也爲于僞反注同⬤子兮反司馬云碎也
長於上古而不爲老,日新也○長丁丈反
覆載天地刻彫衆形而不爲巧,自然故非巧也
此所遊已,遊於不爲而師於無師也
顔回曰回益矣,以損之爲益也
仲尼曰何謂也曰回忘仁義矣曰可矣猶未也,仁者兼愛之迹義者成物之功愛之非仁仁迹行焉成之非義義功見焉存夫仁義不足以知愛利之由無心故忘之可也但忘功迹故猶未玄逹○見賢遍反下文同
它日復見曰回益矣曰何謂也曰回忘禮樂矣曰可矣猶未也,禮者形體之用樂者樂生之具忘其具未若忘其所以具也○它日崔本作異旦下亦然復扶又反下同樂音洛又音嶽
它日復見曰回益矣曰何謂也曰回坐忘矣仲尼蹵然曰何謂坐忘顔回曰墮枝體黜聦明離形去知同於大通此謂坐忘,夫坐忘者奚所不忘哉旣⬤其迹又忘其所以迹者內不覺其一身外不識有天地然後曠然與變化爲體而無不通也○蹵然子六反崔云變色貌墮許規反徐又待果反去起吕反知音智坐⬤崔云端坐而⬤
仲尼曰同則無好也,無物不同則未嘗不適朱嘗不適何好何惡哉○好呼報反注同惡烏路反
化則無常也,同於化者唯化所適故無常也
而果其賢乎丘也請從而後也子輿與子桑友而霖⬤十日子輿曰子桑殆病矣裹飯而往食之,此二人相爲於無相爲者也今裹飯而相食者乃任之天理而自爾非相爲而後往也○霖⬤本又作淋音林左傳云⬤三日以往爲霖裹音果食音嗣注同
至子桑之門則若歌若哭鼔琴曰父邪母邪天乎人乎有不任其聲而趨舉其詩焉子輿入曰子之歌詩何故若是,嫌其有情所以趨出逺理○有不任音壬其聲而趨七佳反舉其詩焉崔云不任其聲憊也趨舉其詩無音曲也
曰吾思夫使我至此極者而弗得也父母豈欲吾貧哉天無私覆地無私載天地豈私貧我哉求其爲之者而不得也然而至此極者命也夫,言物皆自然無爲之者也
